{
  "$schema": "http://json-schema.org/draft-07/schema#",
  "title": "User",
  "type": "object",
  "required": ["id", "name", "username", "email"],
  "properties": {
    "id": { "type": "integer", "minimum": 1 },
    "name": { "type": "string", "minLength": 1 },
    "username": { "type": "string", "minLength": 1 },
    "email": { "type": "string", "format": "email", "minLength": 3 },
    "phone": { "type": "string" },
    "website": { "type": "string" },
    "address": {
      "type": "object",
      "required": ["street", "city", "zipcode"],
      "properties": {
        "street": { "type": "string" },
        "suite": { "type": "string" },
        "city": { "type": "string" },
        "zipcode": { "type": "string" },
        "geo": {
          "type": "object",
          "required": ["lat", "lng"],
          "properties": {
            "lat": { "type": "string" },
            "lng": { "type": "string" }
          }
        }
      }
    },
    "company": {
      "type": "object",
      "required": ["name"],
      "properties": {
        "name": { "type": "string" },
        "catchPhrase": { "type": "string" },
        "bs": { "type": "string" }
      }
    }
  },
  "additionalProperties": true
}
