{
  "name": "Jose Hopkins",
  "username": "jose_nx8ycr",
  "email": "jose.hopkins.ibcv96@example.com",
  "phone": "1-400-964-5769 x71139",
  "website": "mccann.com",
  "address": {
    "street": "Deborah Drive",
    "suite": "Apt. 124",
    "city": "Maryton",
    "zipcode": "55272-8724",
    "geo": {
      "lat": "74.8093",
      "lng": "-136.4523"
    }
  },
  "company": {
    "name": "Davis-Cox",
    "catchPhrase": "Multi-tiered next generation neural-net",
    "bs": "incentivize innovative systems"
  },
  "id": 11
}